{
    "cfme_version_mappings": {
        "0.0": "0.0"
    },
    "directory_layouts": [
        {
            "layered_product_version": "5.8",
            "major_version": "6",
            "name": "ChannelDumpsLayout",
            "pattern": "(?x)^\n/\n(?:content|shadow)/\n(?P<type>aus|dist|beta|(?:retired-)?els|eus|htb|rhb|tus|e4s)/\n(?P<platform>rhel)/\n(?P<rhui>rhui/)?\n(?P<variant>[^/]+)/\n(?P<major_version>[0-9][^/]*)/\n(?:[567](?:Client|ComputeNode|Server|Workstation|Everything))/\n(?P<arch>[^/]+)/\n(?:channel\\-dumps/.+)"
        },
        {
            "name": "DirectoryLayoutC",
            "pattern": "(?x)^\n/\n(?:content|shadow)/\n(?P<type>aus|dist|beta|(?:retired-)?els|eus|htb|rhb|tus|e4s)/\n(?P<platform>rhes|rhs|cf-me)/\n(?P<rhui>rhui/)?\n(?P<variant>[^/]+)/\n(?P<major_version>[0-9])\\.(?P<minor_version>[0-9]+)/\n(?P<arch>[^/]+)/"
        },
        {
            "name": "DirectoryLayoutD",
            "pattern": "(?x)^\n(?P<up_to_minor>\n  /\n  (?:content|shadow)/\n  (?P<type>aus|dist|beta|(?:retired-)?els|eus|fastrack|htb|rhb|tus|e4s)/\n  (?P<platform>cf-me|rhel|rhevh|rhes|rhs)/\n  (?P<rhui>rhui/)?(?P<variant>[^/]+)/\n  (?P<major_version>[0-7][^/]*)\n)\n/\n(?P<minor_version>(?:\\$releasever|\\$[0-9]+|[34][AEW]S|[34]Desktop))/\n(?P<arch>[^/]+)/"
        },
        {
            "name": "DirectoryLayoutE",
            "pattern": "(?x)^\n/\n(?:content|shadow)/\n(?P<type>aus|dist|beta|(?:retired-)?els|eus|fastrack|htb|rhb|rc|preview|tus|e4s)/\n(?P<platform>arm|cf-me|rhel|rhevh|rhes|rhs)/\n(?P<rhui>rhui/)?\n(?P<variant>[^/]+)/\n(?P<major_version>[0-9][^./]*)/\n(?P<arch>(?:arm|aarch64|ppc64|s390x|x86_64|multiarch|\\$basearch))/"
        },
        {
            "name": "DirectoryLayoutF",
            "pattern": "(?x)^\n/\n(?:content|shadow)/\n(?P<type>aus|dist|beta|(?:retired-)?els|eus|fastrack|htb|rhb|preview|tus|e4s)/\n(?P<platform>cf-me|rhel|rhevh|rhes|rhs)/\n(?P<rhui>rhui/)?\n(?P<variant>[^/]+)/\n(?P<major_version>[0-9][^/]*)/\n(?:[567](?:Client|ComputeNode|Server|Workstation|Everything))/\n(?P<arch>(?:ppc64|s390x|x86_64|multiarch|\\$basearch))/\n(?!channel-dumps/)"
        },
        {
            "name": "RhelAltLayout",
            "pattern": "(?x)^\n/\n(?:content|shadow)/\n(?P<type>aus|dist|beta|(?:retired-)?els|eus|htb|rhb|tus|e4s)/\n(?P<platform>rhel-alt)/\n(?P<rhui>rhui/)?\n(?P<variant>[^/]+)/\n(?P<major_version>[0-9])/\n(\n  (\\$releasever)|7(Server|Client|ComputeNode|Workstation)|[0-9]\\.\n  (?P<minor_version>[0-9]+)\n)\n/\n(?P<vendor_arch>[^/]+)/\n(?P<arch>[^/]+)/",
            "platform": "rhel",
            "rhelalt": true
        },
        {
            "arch": "x86_64",
            "major_version": "6",
            "name": "ContentISOsLayout",
            "pattern": "(?x)^\n/\ncontent/\ncontentisos(?:/)?",
            "platform": "rhel",
            "type": "dist"
        },
        {
            "arch": "x86_64",
            "name": "SLESLayout",
            "pattern": "(?x)^\n/\ncontent/\n(?P<type>dist|beta)/\nsuse/server/\n(?P<major_version>11|12|15)/\n(?P<minor_version>sp[\\d])/?",
            "platform": "suse"
        },
        {
            "name": "PublicRepoFileLayout",
            "pattern": "(?x)^\n/\ncontent/\npublic/\nrepofiles$",
            "repo": "files",
            "type": "dist"
        }
    ],
    "env_to_releasever_mappings": {
        "prod": {
            "current_rhel0_beta": "0.0",
            "current_rhel0_dist": "0.0",
            "latest_rhel0_beta": "0.0",
            "latest_rhel0_dist": "0.0"
        },
        "qa": {
            "current_rhel0_beta": "0.0",
            "current_rhel0_dist": "0.0",
            "latest_rhel0_beta": "0.0",
            "latest_rhel0_dist": "0.0"
        },
        "stage": {
            "current_rhel0_beta": "0.0",
            "current_rhel0_dist": "0.0",
            "latest_rhel0_beta": "0.0",
            "latest_rhel0_dist": null
        }
    },
    "exclude_from_listings": [
        "0.0"
    ],
    "filter_arches_from_release": {
        "0": [
            "example_64"
        ]
    },
    "ignore_lp_version_product_ids": [
        "000"
    ],
    "origin_alias": [
        {
            "dest": "/origin",
            "src": "/content/origin"
        },
        {
            "dest": "/origin/rpms",
            "src": "/origin/rpm"
        }
    ],
    "override_final_rhel_release": {
        "cs_label_example": "0.0"
    },
    "override_initial_rhel_release": {
        "0": "0.0"
    },
    "release_stream_mappings": {
        "aus": [
            "0.0"
        ],
        "e4s": [
            "0.0"
        ],
        "eus": [
            "0.0"
        ],
        "other": [
            "0.0"
        ],
        "tus": [
            "0.0"
        ]
    },
    "releasever_alias": [
        {
            "dest": "/content/dist/rhel0/0.9",
            "src": "/content/dist/rhel0/0"
        },
        {
            "dest": "/content/dist/rhel1/1.11",
            "src": "/content/dist/rhel1/1"
        }
    ],
    "repo_content_sync": {
        "prod": [
            {
                "populate_dot_repos": false,
                "source": "https://example.com/ubi/data",
                "branch_prefix": "ubi"
            },
            {
                "populate_dot_repos": true,
                "source": "https://example.com/client-tools/data"
            }
        ],
        "stage": [
            {
                "populate_dot_repos": false,
                "source": "https://example.com/ubi/data",
                "branch_prefix": "ubi"
            },
            {
                "populate_dot_repos": true,
                "source": "https://example.com/client-tools/data"
            }
        ]
    },
    "repo_overrides": {
        "prod": [
            {
                "if_match_path": "/content/dist/rhel9/",
                "key": "example",
                "value": true
            },
            {
                "if_created_after": "2023-06-01T14:00:00Z",
                "if_match_id": "rhel-8",
                "key": "example",
                "value": true
            }
        ],
        "stage": [
            {
                "if_match_id": ".",
                "key": "example",
                "value": true
            },
            {
                "if_match_id": "e2e.*rhel-8",
                "key": "example",
                "value": false
            }
        ]
    },
    "rhel_open_dist": [
        0
    ],
    "rhui_alias": [
        {
            "dest": "/content/aus/rhel8",
            "src": "/content/aus/rhel8/rhui"
        },
        {
            "dest": "/content/aus/rhel",
            "src": "/content/aus/rhel/rhui"
        },
        {
            "dest": "/content/beta/rhel8",
            "src": "/content/beta/rhel8/rhui"
        },
        {
            "dest": "/content/beta/rhel-alt",
            "src": "/content/beta/rhel-alt/rhui"
        },
        {
            "dest": "/content/beta/rhel",
            "src": "/content/beta/rhel/rhui"
        },
        {
            "dest": "/content/beta/rhs",
            "src": "/content/beta/rhs/rhui"
        },
        {
            "dest": "/content/dist/layered",
            "src": "/content/dist/layered/rhui"
        },
        {
            "dest": "/content/dist/middleware",
            "src": "/content/dist/middleware/rhui"
        },
        {
            "dest": "/content/dist/rhel8",
            "src": "/content/dist/rhel8/rhui"
        },
        {
            "dest": "/content/dist/rhel-alt",
            "src": "/content/dist/rhel-alt/rhui"
        },
        {
            "dest": "/content/dist/rhel",
            "src": "/content/dist/rhel/rhui"
        },
        {
            "dest": "/content/dist/rhes",
            "src": "/content/dist/rhes/rhui"
        },
        {
            "dest": "/content/dist/rhs",
            "src": "/content/dist/rhs/rhui"
        },
        {
            "dest": "/content/e4s/rhel8",
            "src": "/content/e4s/rhel8/rhui"
        },
        {
            "dest": "/content/e4s/rhel",
            "src": "/content/e4s/rhel/rhui"
        },
        {
            "dest": "/content/els/rhel",
            "src": "/content/els/rhel/rhui"
        },
        {
            "dest": "/content/eus/rhel8",
            "src": "/content/eus/rhel8/rhui"
        },
        {
            "dest": "/content/eus/rhel",
            "src": "/content/eus/rhel/rhui"
        },
        {
            "dest": "/content/rc/rhel",
            "src": "/content/rc/rhel/rhui"
        }
    ],
    "rhui_product_ids": [
        "000",
        "001"
    ],
    "signing_keys_mappings": {
        "default": {
            "beta_keys": [
                "BBBBBBBB"
            ],
            "ga_keys": [
                "00000000"
            ]
        },
        "layered_product": {
            "example-lp": {
                "ga_keys": [
                    "00000000"
                ]
            }
        },
        "major_version": {
            "0": {
                "beta_keys": [
                    "BBBBBBBB"
                ],
                "ga_keys": [
                    "00000000"
                ]
            }
        },
        "platform": {
            "example_none": {
                "ga_keys": []
            },
            "example_platform": {
                "beta_keys": [
                    "BBBBBBBB"
                ],
                "ga_keys": [
                    "FFFFFFFF"
                ]
            }
        }
    },
    "symlink_exceptions": [
        "/this/is/an/example/"
    ],
    "tps_variant_mappings": {
        "example-arch": "Example-Variant"
    },
    "version": "1.3.0"
}